{
  "$schema": "https://json-schema.org/draft/2020-12/schema",
  "$id": "https://pmef.net/schemas/0.9/pmef-catalog.schema.json",
  "title": "PMEF Catalog",
  "description": "Schema for PMEF open catalog files (steel profiles, piping classes, pipe/flange dimensions, materials, instruments, and reference-data mappings). The shape of each 'entries' item is constrained by 'catalogType'.",
  "type": "object",
  "required": [
    "catalogId",
    "catalogType",
    "version",
    "description",
    "entries"
  ],
  "properties": {
    "$schema": {
      "type": "string",
      "description": "Optional JSON Schema reference for editor tooling."
    },
    "catalogId": {
      "type": "string",
      "minLength": 1,
      "description": "Unique catalog identifier, e.g. 'profiles-en'."
    },
    "catalogType": {
      "type": "string",
      "enum": [
        "STEEL_PROFILES",
        "PIPING_CLASS",
        "PIPE_DIMENSIONS",
        "FLANGE_DIMENSIONS",
        "INSTRUMENT_CATALOG",
        "MATERIAL_GRADES",
        "RDL_MAPPING",
        "PIPE_STRESS_MAPPING"
      ],
      "description": "Catalog domain type. Determines the required fields of each entry."
    },
    "standard": {
      "type": "string",
      "description": "Governing standard or code, e.g. 'EN 10025-2' or 'ASME B36.10'."
    },
    "version": {
      "type": "string",
      "minLength": 1,
      "description": "Catalog version string."
    },
    "description": {
      "type": "string",
      "description": "Human-readable summary of the catalog contents."
    },
    "units": {
      "type": "object",
      "description": "Map of field name to unit symbol used across entries.",
      "additionalProperties": {
        "type": "string"
      }
    },
    "fieldDefinitions": {
      "type": "object",
      "description": "Meaning of the entry fields of this catalog (field name -> definition), e.g. which thickness convention a flange catalog uses.",
      "additionalProperties": {
        "type": "string"
      }
    },
    "families": {
      "type": "object",
      "description": "Map of family code to human-readable family name.",
      "additionalProperties": {
        "type": "string"
      }
    },
    "note": {
      "type": "string",
      "description": "Single free-form note about the catalog."
    },
    "notes": {
      "type": "array",
      "description": "List of free-form notes about the catalog.",
      "items": {
        "type": "string"
      }
    },
    "entries": {
      "type": "array",
      "description": "Catalog entries. Item shape is refined by 'catalogType'.",
      "items": {
        "type": "object"
      }
    }
  },
  "allOf": [
    {
      "if": {
        "properties": { "catalogType": { "const": "STEEL_PROFILES" } }
      },
      "then": {
        "properties": {
          "entries": {
            "minItems": 1,
            "items": { "$ref": "#/$defs/steelProfileEntry" }
          }
        }
      }
    },
    {
      "if": {
        "properties": { "catalogType": { "const": "PIPING_CLASS" } }
      },
      "then": {
        "properties": {
          "entries": {
            "minItems": 1,
            "items": { "$ref": "#/$defs/pipingClassEntry" }
          }
        }
      }
    },
    {
      "if": {
        "properties": { "catalogType": { "const": "PIPE_DIMENSIONS" } }
      },
      "then": {
        "properties": {
          "entries": {
            "minItems": 1,
            "items": { "$ref": "#/$defs/pipeDimensionEntry" }
          }
        }
      }
    },
    {
      "if": {
        "properties": { "catalogType": { "const": "FLANGE_DIMENSIONS" } }
      },
      "then": {
        "properties": {
          "entries": {
            "minItems": 1,
            "items": { "$ref": "#/$defs/flangeDimensionEntry" }
          }
        }
      }
    },
    {
      "if": {
        "properties": { "catalogType": { "const": "INSTRUMENT_CATALOG" } }
      },
      "then": {
        "properties": {
          "entries": {
            "minItems": 1,
            "items": { "$ref": "#/$defs/instrumentEntry" }
          }
        }
      }
    },
    {
      "if": {
        "properties": { "catalogType": { "const": "MATERIAL_GRADES" } }
      },
      "then": {
        "properties": {
          "entries": {
            "minItems": 1,
            "items": { "$ref": "#/$defs/materialGradeEntry" }
          }
        }
      }
    },
    {
      "if": {
        "properties": { "catalogType": { "const": "RDL_MAPPING" } }
      },
      "then": {
        "properties": {
          "entries": {
            "minItems": 1,
            "items": { "$ref": "#/$defs/rdlMappingEntry" }
          }
        }
      }
    },
    {
      "if": {
        "properties": { "catalogType": { "const": "PIPE_STRESS_MAPPING" } }
      },
      "then": {
        "required": ["mappings"],
        "properties": {
          "mappings": {
            "type": "array",
            "minItems": 1,
            "items": { "$ref": "#/$defs/pipeStressMappingEntry" }
          }
        }
      }
    }
  ],
  "additionalProperties": true,
  "$defs": {
    "catalogRef": {
      "type": "string",
      "minLength": 1,
      "title": "Catalog Entry Identifier",
      "description": "Stable identifier for the entry, unique within the catalog."
    },
    "steelProfileEntry": {
      "type": "object",
      "title": "Steel Profile Entry",
      "description": "A single hot-rolled or built-up steel profile.",
      "required": ["catalogId", "family"],
      "properties": {
        "catalogId": { "$ref": "#/$defs/catalogRef" },
        "family": {
          "type": "string",
          "title": "Profile Family",
          "description": "Section family code, e.g. 'HEA', 'IPE', 'W', 'L'."
        }
      }
    },
    "pipingClassEntry": {
      "type": "object",
      "title": "Piping Class Entry",
      "description": "A single component selection within a piping class.",
      "required": ["catalogId", "componentClass", "skey", "standard"],
      "properties": {
        "catalogId": { "$ref": "#/$defs/catalogRef" },
        "componentClass": {
          "type": "string",
          "title": "Component Class",
          "description": "Component class, e.g. 'PIPE', 'ELBOW', 'FLANGE', 'VALVE'."
        },
        "skey": {
          "type": "string",
          "title": "Symbol Key",
          "description": "PCF/ISOGEN SKEY identifying the component symbol."
        },
        "standard": {
          "type": "string",
          "title": "Standard",
          "description": "Dimensional/material standard for the component."
        }
      }
    },
    "pipeDimensionEntry": {
      "type": "object",
      "title": "Pipe Dimension Entry",
      "description": "A nominal pipe size with its outside diameter and wall data.",
      "required": ["catalogId", "DN", "OD_mm"],
      "properties": {
        "catalogId": { "$ref": "#/$defs/catalogRef" },
        "DN": {
          "type": "number",
          "title": "Nominal Diameter",
          "description": "Nominal diameter (DN)."
        },
        "OD_mm": {
          "type": "number",
          "exclusiveMinimum": 0,
          "title": "Outside Diameter",
          "description": "Outside diameter in millimetres."
        }
      }
    },
    "flangeDimensionEntry": {
      "type": "object",
      "title": "Flange Dimension Entry",
      "description": "A single flange dimension row for a size/rating pair.",
      "required": ["catalogId", "nominalDiameter", "pressureClass", "flangeOD_mm"],
      "properties": {
        "catalogId": { "$ref": "#/$defs/catalogRef" },
        "nominalDiameter": {
          "type": "number",
          "title": "Nominal Diameter",
          "description": "Nominal diameter (DN)."
        },
        "pressureClass": {
          "type": ["number", "string"],
          "title": "Pressure Class",
          "description": "Flange pressure class: numeric ASME class (150, 300, 600) or EN nominal pressure string ('PN10', 'PN16')."
        },
        "flangeOD_mm": {
          "type": "number",
          "exclusiveMinimum": 0,
          "title": "Flange Outside Diameter",
          "description": "Flange outside diameter in millimetres."
        },
        "NPS": { "type": "number", "exclusiveMinimum": 0, "description": "Nominal pipe size [in] (ASME)." },
        "DN": { "type": "integer", "exclusiveMinimum": 0, "description": "Nominal diameter DN (EN)." },
        "flangeThickness_mm": { "type": "number", "exclusiveMinimum": 0, "description": "Flange thickness [mm]; convention per the catalog's fieldDefinitions (ASME B16.5: tf without raised face; EN 1092-1: C1)." },
        "boltCircle_mm": { "type": "number", "exclusiveMinimum": 0, "description": "Bolt circle diameter [mm]." },
        "boltHoles": { "type": "integer", "minimum": 4, "multipleOf": 4, "description": "Number of bolt holes." },
        "boltDiameter_mm": { "type": "number", "exclusiveMinimum": 0, "description": "Nominal bolt (stud) diameter [mm] (M12 -> 12; 1/2 in -> 12.7)." },
        "boltHoleDiameter_mm": { "type": "number", "exclusiveMinimum": 0, "description": "Bolt hole diameter [mm]." },
        "raisedFace_mm": { "type": "number", "exclusiveMinimum": 0, "description": "Raised face diameter [mm]." },
        "facingType": { "type": "string", "enum": ["RF", "FF", "RTJ"], "description": "Facing: raised face, flat face, ring-type joint." }
      }
    },
    "instrumentEntry": {
      "type": "object",
      "title": "Instrument Entry",
      "description": "A single field instrument type in the instrument catalog.",
      "required": ["catalogId", "instrumentType", "measuredVariable"],
      "properties": {
        "catalogId": { "$ref": "#/$defs/catalogRef" },
        "instrumentType": {
          "type": "string",
          "title": "Instrument Type",
          "description": "Instrument type, e.g. 'TRANSMITTER', 'GAUGE', 'SWITCH'."
        },
        "measuredVariable": {
          "type": "string",
          "title": "Measured Variable",
          "description": "Measured variable, e.g. 'TEMPERATURE', 'PRESSURE', 'FLOW'."
        }
      }
    },
    "materialGradeEntry": {
      "type": "object",
      "title": "Material Grade Entry",
      "description": "A single material grade with mechanical properties.",
      "required": ["catalogId", "designation", "standard", "family"],
      "properties": {
        "catalogId": { "$ref": "#/$defs/catalogRef" },
        "designation": {
          "type": "string",
          "title": "Designation",
          "description": "Material designation, e.g. 'S235JR', 'A36'."
        },
        "standard": {
          "type": "string",
          "title": "Standard",
          "description": "Material standard, e.g. 'EN 10025-2', 'ASTM A36/A36M'."
        },
        "family": {
          "type": "string",
          "title": "Material Family",
          "description": "Material family/grouping code."
        }
      }
    },
    "rdlMappingEntry": {
      "type": "object",
      "title": "RDL Mapping Entry",
      "description": "A mapping from a PMEF type to a reference-data-library URI.",
      "required": ["pmefType", "rdlUri", "label"],
      "properties": {
        "pmefType": {
          "type": "string",
          "title": "PMEF Type",
          "description": "PMEF type token, e.g. 'pmef:Pump'."
        },
        "equipmentClass": {
          "type": "string",
          "title": "Equipment Class",
          "description": "Optional equipment sub-class modifier, e.g. 'CENTRIFUGAL_PUMP'."
        },
        "componentClass": {
          "type": "string",
          "title": "Component Class",
          "description": "Optional piping component sub-class modifier, e.g. 'ELBOW'."
        },
        "instrumentClass": {
          "type": "string",
          "title": "Instrument Class",
          "description": "Optional instrument sub-class modifier."
        },
        "rdlUri": {
          "type": "string",
          "format": "uri",
          "title": "RDL URI",
          "description": "Reference-data-library URI (e.g. POSC Caesar RDL)."
        },
        "label": {
          "type": "string",
          "title": "Label",
          "description": "Human-readable label for the mapped concept."
        }
      }
    },
    "pipeStressMappingEntry": {
      "type": "object",
      "title": "Pipe Stress Mapping Entry",
      "description": "A single field mapping between a pipe-stress interchange format (e.g. CAESAR II .cii) and a PMEF path. Carried in the top-level 'mappings' array; 'entries' is unused for this catalog type.",
      "required": ["section", "ciiField", "ciiRecord", "direction", "pmefPath"],
      "properties": {
        "section": {
          "type": "string",
          "title": "Section",
          "description": "Logical section of the source format the field belongs to."
        },
        "ciiField": {
          "type": "string",
          "title": "Source Field",
          "description": "Field name in the pipe-stress format (e.g. CAESAR II .cii field)."
        },
        "ciiRecord": {
          "type": "string",
          "title": "Source Record",
          "description": "Record/table in the pipe-stress format that holds the field."
        },
        "direction": {
          "type": "string",
          "enum": ["import", "export", "bidirectional"],
          "title": "Mapping Direction",
          "description": "Direction in which the mapping applies."
        },
        "pmefPath": {
          "type": "string",
          "title": "PMEF Path",
          "description": "Target path within the PMEF model for the mapped value."
        }
      }
    }
  }
}
